[
  {
    "id": "source_revision_20260816110634_source_cabinet_notifications_r8_kumamoto_earthquake",
    "sourceId": "source_cabinet_notifications_r8_kumamoto_earthquake",
    "url": "https://www.bousai.go.jp/updates/r8kumamoto_jishin/tsuuchi.html",
    "detectedAt": "2026-08-16T11:06:34+09:00",
    "previousHash": "sha256:15ce0caadfcb81fe5df14c3172d28fa1db0af1ba007f6c1d17da899fda487b89",
    "currentHash": "sha256:2621019a12293548fa83d89302c8632850cf356b598e3b537bfd57c7d5fa8b6d",
    "hashAlgorithm": "normalized-html-v1",
    "eventId": "source_change_20260816110634_source_cabinet_notifications_r8_kumamoto_earthquake"
  },
  {
    "id": "source_revision_20260816110634_source_kumamoto_emergency_housing_repair_page",
    "sourceId": "source_kumamoto_emergency_housing_repair_page",
    "url": "https://www.pref.kumamoto.jp/soshiki/27/275109.html",
    "detectedAt": "2026-08-16T11:06:34+09:00",
    "previousHash": "sha256:10671c73fcba56365221262a4ecc1d8282b784ac784fde03275ca9e6bd508ede",
    "currentHash": "sha256:6a3c1aac75e075983d59cf0a2dccb3d26f2102df1d4e2d4b6f4ffa74a98de983",
    "hashAlgorithm": "normalized-html-v1",
    "eventId": "source_change_20260816110634_source_kumamoto_emergency_housing_repair_page"
  },
  {
    "id": "source_revision_20260816110634_source_uto_support_application_index_r8_earthquake",
    "sourceId": "source_uto_support_application_index_r8_earthquake",
    "url": "https://www.city.uto.lg.jp/article/list/1307.html",
    "detectedAt": "2026-08-16T11:06:34+09:00",
    "previousHash": "sha256:90511e530262bcbfab92716a1d2fc9f6480daedeb033a64c045a7a633d0fbb8e",
    "currentHash": "sha256:45c8ea66ca1fe554f6c71f255aa84e8fdce1ccf053d0dde1ead637f4452559ee",
    "hashAlgorithm": "normalized-html-v1",
    "eventId": "source_change_20260816110634_source_uto_support_application_index_r8_earthquake"
  },
  {
    "id": "source_revision_20260816110634_source_uto_emergency_housing_repair_page_r8_earthquake",
    "sourceId": "source_uto_emergency_housing_repair_page_r8_earthquake",
    "url": "https://www.city.uto.lg.jp/article/view/1243/16523.html",
    "detectedAt": "2026-08-16T11:06:34+09:00",
    "previousHash": "sha256:3f3a679b1125379e1d067cf22d9401e231243993ee4de38d201a2da226224f73",
    "currentHash": "sha256:e49d7edd0c2fd41913904337fc124c8af1aa8e22abefc65cfeb67435acb1644d",
    "hashAlgorithm": "normalized-html-v1",
    "eventId": "source_change_20260816110634_source_uto_emergency_housing_repair_page_r8_earthquake"
  },
  {
    "id": "source_revision_20260816110634_source_uto_housing_consultation_desk_r8_earthquake",
    "sourceId": "source_uto_housing_consultation_desk_r8_earthquake",
    "url": "https://www.city.uto.lg.jp/article/view/1307/16522.html",
    "detectedAt": "2026-08-16T11:06:34+09:00",
    "previousHash": "sha256:da6e8e83f6285be679e8a05b33443923ec2ca57eb25d338764319683d4e01343",
    "currentHash": "sha256:9ecfa41028a4e151a3a85a3018a6ffa4cbdf68b0ba95de353ed9aa5936b828a8",
    "hashAlgorithm": "normalized-html-v1",
    "eventId": "source_change_20260816110634_source_uto_housing_consultation_desk_r8_earthquake"
  },
  {
    "id": "source_revision_20260816130953_source_uto_support_application_index_r8_earthquake",
    "sourceId": "source_uto_support_application_index_r8_earthquake",
    "url": "https://www.city.uto.lg.jp/article/list/1307.html",
    "detectedAt": "2026-08-16T13:09:53+09:00",
    "previousHash": "sha256:45c8ea66ca1fe554f6c71f255aa84e8fdce1ccf053d0dde1ead637f4452559ee",
    "currentHash": "sha256:e92d3e59cd0a75fc498e41b79b7f41ac9e3e9e409d971afdc7e6588d1f145faa",
    "hashAlgorithm": "normalized-html-v1",
    "eventId": "source_change_20260816130953_source_uto_support_application_index_r8_earthquake"
  },
  {
    "id": "source_revision_20260816130953_source_uto_housing_consultation_desk_r8_earthquake",
    "sourceId": "source_uto_housing_consultation_desk_r8_earthquake",
    "url": "https://www.city.uto.lg.jp/article/view/1307/16522.html",
    "detectedAt": "2026-08-16T13:09:53+09:00",
    "previousHash": "sha256:9ecfa41028a4e151a3a85a3018a6ffa4cbdf68b0ba95de353ed9aa5936b828a8",
    "currentHash": "sha256:8f2024747cb374f2e1fdab0111a0fcf8a8e99ff001ec97aaf96cba2610f67544",
    "hashAlgorithm": "normalized-html-v1",
    "eventId": "source_change_20260816130953_source_uto_housing_consultation_desk_r8_earthquake"
  },
  {
    "id": "source_revision_20260816161018_source_uto_emergency_housing_repair_page_r8_earthquake",
    "sourceId": "source_uto_emergency_housing_repair_page_r8_earthquake",
    "url": "https://www.city.uto.lg.jp/article/view/1243/16523.html",
    "detectedAt": "2026-08-16T16:10:18+09:00",
    "previousHash": "sha256:e49d7edd0c2fd41913904337fc124c8af1aa8e22abefc65cfeb67435acb1644d",
    "currentHash": "sha256:9defcc91765da226b7b370984a3d589cb798e61017bc1d9d18c1049832fb3bc2",
    "hashAlgorithm": "normalized-html-v1",
    "eventId": "source_change_20260816161018_source_uto_emergency_housing_repair_page_r8_earthquake"
  },
  {
    "id": "source_revision_20260817111604_source_kumamoto_emergency_housing_repair_page",
    "sourceId": "source_kumamoto_emergency_housing_repair_page",
    "url": "https://www.pref.kumamoto.jp/soshiki/27/275109.html",
    "detectedAt": "2026-08-17T11:16:04+09:00",
    "previousHash": "sha256:6a3c1aac75e075983d59cf0a2dccb3d26f2102df1d4e2d4b6f4ffa74a98de983",
    "currentHash": "sha256:e839dfce52df6fe251f85d98490d41c16c0191b78a05c3a8e978ed7a1bb693e4",
    "hashAlgorithm": "normalized-html-v1",
    "eventId": "source_change_20260817111604_source_kumamoto_emergency_housing_repair_page"
  },
  {
    "id": "source_revision_20260817111604_source_uto_support_application_index_r8_earthquake",
    "sourceId": "source_uto_support_application_index_r8_earthquake",
    "url": "https://www.city.uto.lg.jp/article/list/1307.html",
    "detectedAt": "2026-08-17T11:16:04+09:00",
    "previousHash": "sha256:e92d3e59cd0a75fc498e41b79b7f41ac9e3e9e409d971afdc7e6588d1f145faa",
    "currentHash": "sha256:6456859a58b4686384bbd143dad29a0ddc40e6afd50def3505cd4dec2188d6fe",
    "hashAlgorithm": "normalized-html-v1",
    "eventId": "source_change_20260817111604_source_uto_support_application_index_r8_earthquake"
  },
  {
    "id": "source_revision_20260817191717_source_cabinet_notifications_r8_kumamoto_earthquake",
    "sourceId": "source_cabinet_notifications_r8_kumamoto_earthquake",
    "url": "https://www.bousai.go.jp/updates/r8kumamoto_jishin/tsuuchi.html",
    "detectedAt": "2026-08-17T19:17:17+09:00",
    "previousHash": "sha256:2621019a12293548fa83d89302c8632850cf356b598e3b537bfd57c7d5fa8b6d",
    "currentHash": "sha256:24c89c030617df358fe2f8e32674df0aa49704706d10b7486959356de9d9e8e2",
    "hashAlgorithm": "normalized-html-v1",
    "eventId": "source_change_20260817191717_source_cabinet_notifications_r8_kumamoto_earthquake"
  },
  {
    "id": "source_revision_20260817191717_source_uto_support_application_index_r8_earthquake",
    "sourceId": "source_uto_support_application_index_r8_earthquake",
    "url": "https://www.city.uto.lg.jp/article/list/1307.html",
    "detectedAt": "2026-08-17T19:17:17+09:00",
    "previousHash": "sha256:6456859a58b4686384bbd143dad29a0ddc40e6afd50def3505cd4dec2188d6fe",
    "currentHash": "sha256:dd014259d0d7fcfb06b79d922194313e2b683ffd07c1235bb0a11926b268ad5b",
    "hashAlgorithm": "normalized-html-v1",
    "eventId": "source_change_20260817191717_source_uto_support_application_index_r8_earthquake"
  },
  {
    "id": "source_revision_20260817191717_source_uto_emergency_housing_repair_page_r8_earthquake",
    "sourceId": "source_uto_emergency_housing_repair_page_r8_earthquake",
    "url": "https://www.city.uto.lg.jp/article/view/1243/16523.html",
    "detectedAt": "2026-08-17T19:17:17+09:00",
    "previousHash": "sha256:9defcc91765da226b7b370984a3d589cb798e61017bc1d9d18c1049832fb3bc2",
    "currentHash": "sha256:72fda72ecc5c6c27232f1218c743c9ce57d762d2dac0f47f86231c4dacf5061f",
    "hashAlgorithm": "normalized-html-v1",
    "eventId": "source_change_20260817191717_source_uto_emergency_housing_repair_page_r8_earthquake"
  },
  {
    "id": "source_revision_20260817191717_source_uto_housing_consultation_desk_r8_earthquake",
    "sourceId": "source_uto_housing_consultation_desk_r8_earthquake",
    "url": "https://www.city.uto.lg.jp/article/view/1307/16522.html",
    "detectedAt": "2026-08-17T19:17:17+09:00",
    "previousHash": "sha256:8f2024747cb374f2e1fdab0111a0fcf8a8e99ff001ec97aaf96cba2610f67544",
    "currentHash": "sha256:2f5488e36fcbb8b8f23202eb2a2532701eb600c9a069afd11cdb9bbf17ca8234",
    "hashAlgorithm": "normalized-html-v1",
    "eventId": "source_change_20260817191717_source_uto_housing_consultation_desk_r8_earthquake"
  },
  {
    "id": "source_revision_20260818132049_source_cabinet_notifications_r8_kumamoto_earthquake",
    "sourceId": "source_cabinet_notifications_r8_kumamoto_earthquake",
    "url": "https://www.bousai.go.jp/updates/r8kumamoto_jishin/tsuuchi.html",
    "detectedAt": "2026-08-18T13:20:49+09:00",
    "previousHash": "sha256:24c89c030617df358fe2f8e32674df0aa49704706d10b7486959356de9d9e8e2",
    "currentHash": "sha256:26c129ebf313ce5fe1612d24183c1cc7a433f6b026aa1710645f882fa4741f6e",
    "hashAlgorithm": "normalized-html-v1",
    "eventId": "source_change_20260818132049_source_cabinet_notifications_r8_kumamoto_earthquake"
  },
  {
    "id": "source_revision_20260818132049_source_uto_support_application_index_r8_earthquake",
    "sourceId": "source_uto_support_application_index_r8_earthquake",
    "url": "https://www.city.uto.lg.jp/article/list/1307.html",
    "detectedAt": "2026-08-18T13:20:49+09:00",
    "previousHash": "sha256:dd014259d0d7fcfb06b79d922194313e2b683ffd07c1235bb0a11926b268ad5b",
    "currentHash": "sha256:e393c69f918988ac8a626d8b4c151ee48f7a514f3791a25e9d379a0398abceab",
    "hashAlgorithm": "normalized-html-v1",
    "eventId": "source_change_20260818132049_source_uto_support_application_index_r8_earthquake"
  },
  {